{"event_id":"event-001","event_type":"execution.started","schema_id":"event-envelope","schema_version":"1.0.0","occurred_at":"2026-07-25T00:01:00Z","recorded_at":"2026-07-25T00:01:01Z","producer_id":"orchestrator-001","actor_id":"worker-001","q_id":"Q-DEMO-001","repository_id":"GDS-DOCS","approval_id":"approval-exec-001","execution_id":"exec-001","attempt_id":"attempt-001","artifact_id":null,"effect_id":null,"correlation_id":"corr-001","causation_id":"event-package-created","idempotency_key":"exec-001:attempt-001:started","sequence":2,"status":"OBSERVED","payload_digest":"sha256:bbbbbbbbbbbbbbbbbbbbbbbbbbbbbbbbbbbbbbbbbbbbbbbbbbbbbbbbbbbbbbbb","payload":{"state":"Running"}}
